_id,poi_name,title,date,review_rating,text,date_of_visit,reviewer
"{'id': '592394658', 'poi_location_id': '10390159', 'geolocation': 'g189473'}",Room with a View,Does what it says on the tin: Room with a View,"July 2, 2018",40,"Not very certain on opening hours, this interesting cafed is located above Olympion cinema. A bit culturelle, but not above what's tolerable and with a nice view.",September 2017,"{'name': 'pchatzi2017', 'handle': 'pchatzi2017', 'location': 'Athens, Greece', 'age': '35-49', 'sex': 'man', 'contributions': 33, 'cities_visited': 107, 'helpful_votes': 26, 'photo': 3, 'distribution': {'Excellent': 17, 'Very Good': 13, 'Average': 2, 'Poor': 1, 'Terrible': 1}}"
"{'id': '749748229', 'poi_location_id': '13339737', 'geolocation': 'g189473'}",To Tourlou,Ιδιαίτερη κουζίνα.,"March 7, 2020",40,"Το μαγαζί σίγουρα δε προκαλεί από μόνο του να το επισκεφτεί κάποιος ειδικά βράδυ . Άβολα τραπεζια και καρέκλες, τελείως αδιάφορο περιβάλλον. Αν όμως ανοίξεις τον κατάλογο τα αρνητικά πάνε στην άκρη και τα πράγματα αλλάζουν. Πρωτότυπα πιάτα, πλούσια κάβα, καλό σέρβις, λογικότατες τιμές. Φεύγοντας λες, να ξανάρθω να δοκιμάσω κι άλλα πιάτα. Κι ας είναι το περιβάλλον μόνο για μεσημέρι και για ανδροπαρέες....",March 2020,"{'name': 'Antonis C', 'handle': 'ANTONIS1967', 'location': 'Thessaloniki, Greece', 'age': '50-64', 'sex': 'man', 'contributions': 65, 'cities_visited': 40, 'helpful_votes': 11, 'distribution': {'Excellent': 19, 'Very Good': 31, 'Average': 15, 'Poor': 0, 'Terrible': 0}}"
"{'id': '552216421', 'poi_location_id': '10390159', 'geolocation': 'g189473'}",Room with a View,What a view,"January 7, 2018",30,"Located in the heart of the city, on the 5th floor of a beautiful building with a classic cinema, it' s perfect for a coffee after shopping. The customers are mostly young people (college students). Sadly, when it's crowded there is too much noise and smoke.",January 2018,"{'name': 'TheCuriousEl', 'handle': 'TheCuriousEl', 'location': 'Athens, Greece', 'age': '35-49', 'sex': 'woman', 'contributions': 102, 'cities_visited': 119, 'helpful_votes': 54, 'photo': 14, 'distribution': {'Excellent': 40, 'Very Good': 24, 'Average': 35, 'Poor': 4, 'Terrible': 0}}"
"{'id': '747031238', 'poi_location_id': '13339737', 'geolocation': 'g189473'}",To Tourlou,Όλα τέλεια,"February 23, 2020",50,"Καταπληκτικοί μεζέδες με πολύ ωραίο και ποιοτικό κρασί.Φυσιολογικές τιμές και οι άνθρωποι που το δουλεύουν πολύ φιλόξενοι. Το μαγαζί έχει χαρακτήρα με αυθεντικές μουσικές ,κάτι που δε συνηθίζεται στις μέρες μας.",February 2020,"{'name': 'Nikos P', 'handle': 'D6234IQnikosp', 'location': 'Thessaloniki, Greece', 'contributions': 1, 'cities_visited': 1}"
"{'id': '453869740', 'poi_location_id': '10390159', 'geolocation': 'g189473'}",Room with a View,Nice cafe,"January 21, 2017",40,On the top of Olympion there is this cafe. Great view of Aristotelous square and nice coffee. The prices are normal comparing the location.,September 2016,"{'name': 'MarianThi', 'handle': 'isthatyoumarian', 'location': 'Athens, Greece', 'age': '25-34', 'sex': 'woman', 'contributions': 84, 'cities_visited': 219, 'helpful_votes': 33, 'photo': 31, 'distribution': {'Excellent': 36, 'Very Good': 32, 'Average': 8, 'Poor': 6, 'Terrible': 2}}"
"{'id': '593318651', 'poi_location_id': '810275', 'geolocation': 'g189473'}",Pastaflora Darling Cafe,Great to chill,"July 5, 2018",40,Nice place to have some drinks and chill out while talking with friends; good service and nice drinks,July 2018,{}
"{'id': '745410952', 'poi_location_id': '13339737', 'geolocation': 'g189473'}",To Tourlou,Σούπερ Τουρλού,"February 16, 2020",50,Μεζέδες και πιάτα ημέρας εξαιρετικά. Προσεγμένα με σπιτική γεύση. Κρασί κ ρακί σούπερ. Οπουδήποτε καβουρμά τουρλού. Για τους μερακλήδες λουκάνικο μπαρουτ (καυτερό),February 2020,"{'name': 'psomod', 'handle': 'psomod', 'location': 'Thessaloniki, Greece', 'contributions': 7, 'cities_visited': 4, 'helpful_votes': 2, 'photo': 1, 'distribution': {'Excellent': 6, 'Very Good': 0, 'Average': 1, 'Poor': 0, 'Terrible': 0}}"
"{'id': '436301438', 'poi_location_id': '10390159', 'geolocation': 'g189473'}",Room with a View,Underappreciated!,"November 10, 2016",50,"Visited twice during the last 2 years and both times were excellent. The first time was late evening for a drink which was well prepared with great atmosphere, Latin music and polite service. Second time it was a little earlier during the day for a coffee. Good coffee and service again and overall a quite environment right in the heart of the city. Make sure to book a table near a window if you visit during popular hours, the view is one of the best in Aristotelous square. Haven't tried the food yet but it's the next item on the list.",February 2016,"{'name': 'Chrysanthos_Bambu', 'handle': 'Chrysanthos_Bambu', 'location': 'Thessaloniki, Greece', 'age': '25-34', 'sex': 'man', 'contributions': 53, 'cities_visited': 10, 'helpful_votes': 9, 'photo': 16, 'distribution': {'Excellent': 24, 'Very Good': 22, 'Average': 5, 'Poor': 2, 'Terrible': 0}}"
"{'id': '571679726', 'poi_location_id': '810275', 'geolocation': 'g189473'}",Pastaflora Darling Cafe,Young and outstanding,"April 7, 2018",40,"A very lively bar to spend an evening with friends. The cocktails are good and reasonably priced. The place had a really positive vibe and great atmosphere - also, the interesting decorum is certainly quite a sight.",April 2018,"{'name': 'Tirell', 'handle': 'Tirell', 'location': 'Munich, Germany', 'contributions': 138, 'cities_visited': 127, 'helpful_votes': 94, 'photo': 227, 'distribution': {'Excellent': 43, 'Very Good': 66, 'Average': 21, 'Poor': 10, 'Terrible': 0}}"
"{'id': '731040515', 'poi_location_id': '13339737', 'geolocation': 'g189473'}",To Tourlou,Εξαιρετικό φαγητό και κρασί,"December 6, 2019",50,Καταπληκτικό φαγητό. Οτι εχουμε παρει τις τελευταίες 3 φορές που έχουμε παει ειναι πεντανόστιμο και ποιοτικοτάτο. Έχει μια πολυ καλη συλλογή απο παραδοσιακα τυρια και πολυ ωραίο λευκο χύμα κρασί. Δοκιμάστε τις πιτες που αναγράφονται στα πιατα ημέρας και θα εκπλαγείτε. Must πιάτο η μελοπιτα! Στο τέλος σερβίρουν και γλυκό κορμο σοκολάτας. Αξιζει πραγματικά!,December 2019,"{'name': 'Vasso G', 'handle': 'vassogvr', 'location': 'Thessaloniki, Greece', 'contributions': 3, 'cities_visited': 2, 'distribution': {'Excellent': 3, 'Very Good': 0, 'Average': 0, 'Poor': 0, 'Terrible': 0}}"
"{'id': '403039687', 'poi_location_id': '10390159', 'geolocation': 'g189473'}",Room with a View,Excellent view!,"August 8, 2016",50,That is if you can find a table near a window. Then you will enjoy your coffee with the e best view in town. Very interesting if you happen to be in the city for the International Film Festival. Then you might meet some international celebrities formteh film industry.,October 2015,"{'name': 'Billie T', 'handle': 'vasilikibilliet', 'location': 'Wauwatosa, Wisconsin', 'age': '35-49', 'sex': 'woman', 'contributions': 50, 'cities_visited': 366, 'helpful_votes': 17, 'photo': 1, 'distribution': {'Excellent': 42, 'Very Good': 6, 'Average': 2, 'Poor': 0, 'Terrible': 0}}"
"{'id': '564858184', 'poi_location_id': '810275', 'geolocation': 'g189473'}",Pastaflora Darling Cafe,Comfy & Pretty,"March 6, 2018",40,"Really nice caffe in the heart of the city. Pretty easy to find. Atmosphere is great and the walls are beautifully decorated. Not too loud, in case u wanna have a conversation with a friend. As a Vegan, I had the choice to order a hot chocolate made with almond milk and my friend got a hot apple juice, which I tried and I can safely say, both tasted A-MA-ZING. Definitely ordering the juice next time i'm there.",March 2018,"{'name': 'goodiekay', 'handle': 'goodiekay', 'location': 'Dusseldorf, Germany', 'age': '18-24', 'sex': 'woman', 'contributions': 10, 'cities_visited': 3, 'helpful_votes': 3, 'distribution': {'Excellent': 8, 'Very Good': 1, 'Average': 0, 'Poor': 0, 'Terrible': 1}}"
"{'id': '721187626', 'poi_location_id': '13339737', 'geolocation': 'g189473'}",To Tourlou,ΒΡΗΚΑΜΕ ΤΟ ΣΤΕΚΙ ΜΑΣ!!!,"October 25, 2019",50,"Ομορφο περιβάλλον πολύ καλή εξυπηρέτηση, νόστιμα και ιδιαίτερα πιάτα, πολύ καλή μουσική. Τί άλλο να θέλει κανείς? Μπράβο σας!!!Μένω στην περιοχή και χαίρομαι πολύ που βρήκα ένα μαγαζί που τα συνδυάζει όλα....",September 2019,"{'name': 'Vana K', 'handle': '703vanak', 'contributions': 5, 'cities_visited': 2, 'helpful_votes': 7, 'distribution': {'Excellent': 4, 'Very Good': 0, 'Average': 0, 'Poor': 0, 'Terrible': 1}}"
"{'id': '392566191', 'poi_location_id': '10390159', 'geolocation': 'g189473'}",Room with a View,The view,"July 14, 2016",40,"The place is full of character and its view is majestic! Not many cafes in Thessaloniki have such a view. Its only problem is that it's always full, so it's not easy to find a place to sit.",October 2015,"{'name': 'James_Vlake', 'handle': 'James_Vlake', 'location': 'Thessaloniki, Greece', 'age': '35-49', 'sex': 'man', 'contributions': 60, 'cities_visited': 615, 'helpful_votes': 67, 'photo': 164, 'distribution': {'Excellent': 42, 'Very Good': 12, 'Average': 3, 'Poor': 1, 'Terrible': 2}}"
"{'id': '552179425', 'poi_location_id': '810275', 'geolocation': 'g189473'}",Pastaflora Darling Cafe,Quirky Bar,"January 7, 2018",50,This place in my opinion is one of the best places in the city to go relax and chill on your own or with friends. Its such a relaxing place to visit . The staff are very friendly and polite which is a good start when visiting a place for the first time and is not always the case in the city. This was our first time and will defo be going back for a second and third visit .Going to try it one evening as the cocktail list looked Fab.... It was the ones name day and as we sat down was offered choclates which was a lovely touch .,January 2018,"{'name': '7750J', 'handle': '7750J', 'location': 'Thassos Town (Limenas), Greece', 'age': '35-49', 'sex': 'man', 'contributions': 61, 'cities_visited': 22, 'helpful_votes': 55, 'photo': 109, 'distribution': {'Excellent': 47, 'Very Good': 9, 'Average': 2, 'Poor': 2, 'Terrible': 1}}"
"{'id': '714499422', 'poi_location_id': '13339737', 'geolocation': 'g189473'}",To Tourlou,Τσίπουρο και blues,"October 1, 2019",50,Πολύ όμορφο περιβάλλον. Πολύ καλό φαΐ ποιοτικό με υλικά από μικρές μονάδες πολύ καλή ρακή με πολύ καλή μουσική blues - rock. To προσωπικό πολύ φιλικό. Συνίσταται ανεπιφύλακτα,October 2019,"{'name': 'Vassilis loppas', 'handle': 'Vassilis375', 'contributions': 28, 'cities_visited': 14, 'helpful_votes': 24, 'distribution': {'Excellent': 10, 'Very Good': 17, 'Average': 3, 'Poor': 0, 'Terrible': 0}}"
"{'id': '383120573', 'poi_location_id': '10390159', 'geolocation': 'g189473'}",Room with a View,"""Room with a view"" away of the city's noise","June 16, 2016",50,"Warm, friendly, ""Room with a view"" like storyline of a movie. Over the history of cinema Olympion serves quality coffee and is the ideal place for anyone who wants to chat in relaxed tones and hear great funk, soul, jazz and pop music. The front tables have great view of Aristotelous Square and Thermaikos.",June 2016,"{'name': 'amantzou', 'handle': 'amantzou', 'location': 'Athens, Greece', 'contributions': 52, 'cities_visited': 142, 'helpful_votes': 52, 'photo': 34, 'distribution': {'Excellent': 38, 'Very Good': 10, 'Average': 5, 'Poor': 0, 'Terrible': 0}}"
"{'id': '542154228', 'poi_location_id': '810275', 'geolocation': 'g189473'}",Pastaflora Darling Cafe,Charming Thessaloniki Cafe,"November 20, 2017",50,"A must visit if you happen to be in downtown thessaloniki and want a good cup of coffee,lovely homely atmosphere,vintage decor with adorable little touches.Great for animal lovers as pets are allowed.",November 2017,"{'name': 'Desdam', 'handle': 'Desidam', 'location': 'Limassol City, Cyprus', 'contributions': 5, 'cities_visited': 4, 'helpful_votes': 1, 'distribution': {'Excellent': 4, 'Very Good': 0, 'Average': 0, 'Poor': 0, 'Terrible': 1}}"
"{'id': '702903616', 'poi_location_id': '13339737', 'geolocation': 'g189473'}",To Tourlou,Blues - rock τσιπουρο,"August 25, 2019",40,"Πολύ ωραία και νόστιμα πιάτα, όμορφο περιβάλλον. Το σαγανάκι παστουρμα ήταν εξαιρετικο η μουσική πολύ καλή και το προσωπικό φιλικό...More",August 2019,"{'name': 'Vassilis Lοppas', 'handle': '375vassilisl', 'contributions': 2, 'cities_visited': 2, 'helpful_votes': 1}"
"{'id': '460662530', 'poi_location_id': '810275', 'geolocation': 'g189473'}",Pastaflora Darling Cafe,"Nice deco, good coffee and service, nice atmosphere","February 17, 2017",30,"Nicely decorated, if you are into the colourful, 50s, ornamental style. Hipsterish. (Good if you like this style, but if you don't). Good coffee, good service. Music was slightly over the top (in terms of volume). Oh, and it would have been much better if it was non-smoking.",February 2017,"{'name': 'Cim Tarter', 'handle': 'CimTarter25', 'location': 'Nicosia, Cyprus', 'age': '35-49', 'contributions': 74, 'cities_visited': 26, 'helpful_votes': 22, 'photo': 1, 'distribution': {'Excellent': 27, 'Very Good': 21, 'Average': 18, 'Poor': 3, 'Terrible': 5}}"
"{'id': '701881469', 'poi_location_id': '13339737', 'geolocation': 'g189473'}",To Tourlou,Που ακούει η καπνιστή πέστροφα Rory Gallagher?? .. στη Χαριλάου.!!,"August 22, 2019",40,"'Ενα ουζερί-οινοπαντοπωλείο για τσίπουρο-ούζο-κρασό κατάσταση και υπέροχα πιάτα... Μικρός και συμπαθητικός ο εσωτερικός χώρος, μεγαλύτερος ο εξωτερικός επί της Παπαναστασίου. Αρκετά μεγάλος κατάλογος για ένα μικρό ουζερί...'Ολα προσεγμένα από μικρούς παραγωγούς της χώρας... όλα καλομαγειρεμένα και νόστιμα !!!! Κορυφαίο πιάτο τα μαυρομάτικα φασόλια με σπανάκι και καπνιστή πέστροφα-παίρνει 10'!!! Δροσερή ανηθοσαλάτα με γιαούρτι και κατσικίσιο τυρί- εξαιρετική και ντελικάτη.. Νόστιμα γιαλαντζί (δύο μερίδες -μία δεν φτάνει), μπριζολάκια με σπάνια μανιτάρια πολύ καλά... Εξυπηρέτηση καλή και επαγγελματική ...  Και όλα αυτά τα απολαμβάνεις ακούγοντας (επιτέλους βρε αδερφέ) καλή rock μουσική και στην ένταση που πρέπει.!!!! Το Τουρλού... στέκι στην ανατολική Θεσσαλονίκη...",July 2019,"{'name': 'MariaS0raya', 'handle': 'MariaS0raya', 'location': 'Greece', 'contributions': 77, 'cities_visited': 112, 'distribution': {'Excellent': 23, 'Very Good': 41, 'Average': 14, 'Poor': 1, 'Terrible': 0}}"
"{'id': '457326385', 'poi_location_id': '810275', 'geolocation': 'g189473'}",Pastaflora Darling Cafe,Great cute gay-friendly bar,"February 5, 2017",50,"Very cute bar on a pedestrian street! Nice atmosphere, locals, good service and good coffee. Good during the day and open on Sunday! Loved the funky quirky decoration!",February 2017,"{'name': 'Kas_Bxl', 'handle': 'Kas_Bxl', 'location': 'Belgium', 'age': '25-34', 'sex': 'man', 'contributions': 80, 'cities_visited': 103, 'helpful_votes': 43, 'photo': 32, 'distribution': {'Excellent': 29, 'Very Good': 31, 'Average': 16, 'Poor': 3, 'Terrible': 1}}"
"{'id': '696373236', 'poi_location_id': '13339737', 'geolocation': 'g189473'}",To Tourlou,αξίζει να το δοκιμάσεις!,"August 6, 2019",50,ζεστό οικογενειακό μαγαζί με σπιτικά πιάτα με φαντασια και εξαιρετικής ποιότητας υλικά.ευγενικοι ιδιοκτητες και προσωπικό..,June 2019,"{'name': 'Thaleia L', 'handle': '826thaleial', 'contributions': 23, 'cities_visited': 11, 'helpful_votes': 8, 'photo': 2, 'distribution': {'Excellent': 15, 'Very Good': 3, 'Average': 0, 'Poor': 4, 'Terrible': 1}}"
"{'id': '457326112', 'poi_location_id': '810275', 'geolocation': 'g189473'}",Pastaflora Darling Cafe,Nice atmosphere but horrible decoration,"February 5, 2017",30,"Nice atmosphere , gay friendly coffee , many choices good service and well located but I hated the decoration so kitsh lol",February 2017,"{'name': 'Imad A', 'handle': 'mados378', 'location': 'Brussels, Belgium', 'age': '25-34', 'sex': 'man', 'contributions': 116, 'cities_visited': 51, 'helpful_votes': 48, 'photo': 138, 'distribution': {'Excellent': 48, 'Very Good': 28, 'Average': 21, 'Poor': 10, 'Terrible': 10}}"
"{'id': '691112665', 'poi_location_id': '13339737', 'geolocation': 'g189473'}",To Tourlou,❤️❤️❤️❤️❤️❤️,"July 20, 2019",50,"Κάθε μπουκιά και μια μοναδική απόλαυση. Ζεστός μικρός χωρος, ευγενικοί άνθρωποι, υπέροχες γεύσεις που σε ταξιδεύουν.",July 2019,"{'name': 'Maria B', 'handle': 'mariabC648NY', 'location': 'Lamia, Greece', 'contributions': 20, 'cities_visited': 9, 'helpful_votes': 2, 'photo': 5, 'distribution': {'Excellent': 5, 'Very Good': 7, 'Average': 8, 'Poor': 0, 'Terrible': 0}}"
"{'id': '403832214', 'poi_location_id': '810275', 'geolocation': 'g189473'}",Pastaflora Darling Cafe,Nice Atmosphere,"August 10, 2016",50,"I can call myself a regular to this place from now on. I visit this place every single week. It's a small coffee place, downtown, inside the student area of the city. It's cheap and you'll the atmosphere. The theme of the store is around the 70's or 80's and it's loving. They have a good coffee quality and it's price is low. There are a lot of coffee places in this streets but this one is my favorite.",November 2015,"{'name': 'George L', 'handle': 'itsgeorgelith', 'location': 'Thessaloniki, Greece', 'age': '18-24', 'sex': 'man', 'contributions': 70, 'cities_visited': 167, 'helpful_votes': 20, 'photo': 86, 'distribution': {'Excellent': 52, 'Very Good': 14, 'Average': 6, 'Poor': 2, 'Terrible': 0}}"
"{'id': '679983698', 'poi_location_id': '13339737', 'geolocation': 'g189473'}",To Tourlou,Φαγητό με φιλους,"June 8, 2019",50,Μια ευχάριστη έκπληξη σ ένα μικρό όμορφο χώρο. Ψαγμένα πιάτα ωραία μουσική καλό κρασί και πάνω από όλα....καλοι και ευγενικοί ιδιοκτήτες. Ένα μεγάλο μπράβο!!!!!,June 2019,"{'name': 'Aspa K', 'handle': '704aspak', 'contributions': 1, 'cities_visited': 1}"
"{'id': '395435226', 'poi_location_id': '810275', 'geolocation': 'g189473'}",Pastaflora Darling Cafe,Nice!,"July 22, 2016",40,"Pretty nice and freindly place! Situated in a student area, which is packed with students in the evening and at night. The place is clean and the staff is kind and helpful. The decoration of the place is changing many times per year and it really interesting to see the different ideas the owner has. It's perfect for a coffee early in the evening or for a drink later at night",July 2016,"{'name': 'Andrew Gabriel', 'handle': 'punkgoesaround', 'location': 'Copenhagen, Denmark', 'sex': 'man', 'contributions': 168, 'cities_visited': 216, 'helpful_votes': 60, 'photo': 146, 'distribution': {'Excellent': 80, 'Very Good': 69, 'Average': 18, 'Poor': 1, 'Terrible': 0}}"
"{'id': '676393633', 'poi_location_id': '13339737', 'geolocation': 'g189473'}",To Tourlou,Χαμηλοφωνο garage rock και ξυδατο χταποδι στα καρβουνα... is this heaven? ..που θα λεγε κι ο frank zappa..,"May 25, 2019",40,"Η ταλαιπωρημενη χαριλαου απεκτησε επιτελους ενα τσιφτικο στεκι. Αγνα υλικα, οικογενειακη επιχειρηση , ειναι νομιζω αυτη τη στιγμη o top προορισμος για τη νεα γενια {παλιακος ορος ε?} της ανατολικης θεσσαλονικης, και οχι μονο. Τα smart phones δεν λειπουν, αλλα αν τολμησουν οι ιδιοκτητες να εισαγουν την κουλτουρα του κρασιου θα δημιουργηθει παταγος...Αχ αυτη η καχυποψια για τα ποτηρια με ποδι και τα εμφιαλωμενα κρασια επρπεδου που δερνει τους ελληνες. Βοηθηστε ρε παιδια και σεις, Και αναφερομαι σε σχεση με ΟΛΑ τα στεκια, ολης της χωρας.Για τα φαγητα δεν θα πω πολλα ,γιατι δεν θα φτανουν για την παρτη μου. Κοντα τα χερια παντως απο την παντζαροσαλατα με γιαουρτι και πορτοκαλι και την μελιτζανοσαλατα με σταγονιτσες γιαουρτιου και μπαλσαμικο αν θελετε να τα παμε καλα...",May 2019,"{'name': 'swto k', 'handle': 'sw2k', 'contributions': 14, 'cities_visited': 4, 'helpful_votes': 30, 'distribution': {'Excellent': 6, 'Very Good': 4, 'Average': 1, 'Poor': 4, 'Terrible': 0}}"
"{'id': '711227233', 'poi_location_id': '8119334', 'geolocation': 'g189473'}",Paradosiako - Kouskoura,Satisfied of the visit,"September 19, 2019",50,"Very beautiful place, everything was perfect. The salads were big and very taste . The staff was very very friendly. I recommend it :)",September 2019,"{'name': 'Nataly P', 'handle': '467natalyp', 'contributions': 1, 'cities_visited': 1}"
"{'id': '384624613', 'poi_location_id': '810275', 'geolocation': 'g189473'}",Pastaflora Darling Cafe,Blast from the past,"June 21, 2016",40,"it is like i am walking in my childhood's home. I hated this decoration, but in Pasta Flora is absolutely great. I am always returning for a coffee or chocolate when i am in town. Don't forget to meet the mascots of the place: Freideriko, Zoi and Issavela",April 2016,"{'name': 'escapejp', 'handle': 'escapejp', 'location': 'Arachova, Greece', 'age': '50-64', 'sex': 'man', 'contributions': 77, 'cities_visited': 25, 'helpful_votes': 31, 'photo': 69, 'distribution': {'Excellent': 41, 'Very Good': 25, 'Average': 8, 'Poor': 2, 'Terrible': 3}}"
"{'id': '672053345', 'poi_location_id': '13339737', 'geolocation': 'g189473'}",To Tourlou,Από τα καλύτερα μεζεδοπωλεία στου Χαριλάου,"May 7, 2019",40,"Πήγαμε περισσότερο από μία φορά και δοκιμάσαμε αρκετά από τα πιάτα τους! Δεν έχει μεγάλο μενού όμως ότι έχει είναι εξαιρετικό!!!! Τι να πρώτο αναφέρω? Τα υπέροχα τσιγαριστά χόρτα με καβουρμά? την μοναδική τηγανιά με πάπρικα? φοβερές πατατούλες τηγανιτές (με τσαχπινιά στο τηγάνισμα που τις κάνει τραγανές!), ωραία γλώσσα μοσχαρίσια. Δεν χρειάζεται να αναφέρω όλο τον κατάλογο, η ουσία είναι τα πιάτα του καλύπτουν όλα τα γούστα και είναι φτιαγμένα με μεράκι! Το προσωπικό ευγενικό πρόθυμο και χαμογελαστό.Ο μόνος λόγος που δεν το βαθμολόγησα με άριστα είναι το περιβάλλον που έχει πολύ πλαστικό για τα δικά μου γούστα. Ίσως περισσότερες γλάστρες να έκαναν τον χώρο ομορφότερο!",May 2019,"{'name': 'Alkistis K', 'handle': '869alkistisk', 'location': 'Athens, Greece', 'contributions': 24, 'cities_visited': 19, 'helpful_votes': 45, 'distribution': {'Excellent': 14, 'Very Good': 3, 'Average': 3, 'Poor': 4, 'Terrible': 0}}"
"{'id': '711226180', 'poi_location_id': '8119334', 'geolocation': 'g189473'}",Paradosiako - Kouskoura,Very nice and taste,"September 19, 2019",50,"We are very satisfied of our visit there, the salads were very very taste,the staff was also very friendly.Will come back again :)",September 2019,"{'name': 'Martin', 'handle': 'Martintm92', 'contributions': 1, 'cities_visited': 1}"
