_id,poi_name,title,date,review_rating,text,date_of_visit,reviewer
"{'id': '520401579', 'poi_location_id': '8386847', 'geolocation': 'g189473'}",The Blue Cup,Totally recommended!,"September 2, 2017",50,"Me and my friend searched for a place in Thessaloniki where we can get some special and good coctails when we found this place. When we saw the decoration and felt the atmosphere here we immediately knew that this is a must try place. And didn't dissapoint us.. the service was amazingly fast, our waiter was very friendly and made us feel very welcomed and made sure we are satisfied. About the coctails: we tried a few of them. Still not dissapointed. They have a menu with pictures of the drinks and what you get is looks just the same good as in the pics and all of what we tried was tasted very good. So unique atmosphere in the heart of Thessaloniki with great service and good drinks.",August 2017,"{'name': 'Vacationer720260', 'handle': 'Vacationer720260', 'contributions': 1, 'cities_visited': 1}"
"{'id': '648530373', 'poi_location_id': '8759001', 'geolocation': 'g189473'}",JOIN Juice Bars,"Not for salads, rude waitress","January 27, 2019",10,"I went there to get a salad, staff really tried to be helpful but the girl that was there refused to put the sauce of my salad aside for me when I asked her (in order for me to put it later) rather than inside of the salad on the spot for the sake of not ruining the recipe! That definitely ruined my mood though especially when I saw how much sauce she put in the salad which, by the way, had also SUGAR in for no apparent reason! This place considering itself HEALTHY?? I don’t think so! Salad wasn’t very nice either! Quinoa with tons of sauce chicken and tiny bits of carrot and zucchini horrible taste, not healthy at all, very rude girl !!",January 2019,"{'name': 'Fat_at_Heart0000', 'handle': 'Fat_at_Heart0000', 'location': 'Athens, Greece', 'contributions': 45, 'cities_visited': 22, 'helpful_votes': 51, 'photo': 40, 'distribution': {'Excellent': 17, 'Very Good': 15, 'Average': 4, 'Poor': 4, 'Terrible': 5}}"
"{'id': '516061042', 'poi_location_id': '8386847', 'geolocation': 'g189473'}",The Blue Cup,Cliquey and unfriendly- go here if you want to feel like the least cool kid at high school!,"August 21, 2017",10,"When we arrived, the waiter turned and looked at us in a very unpleasant way, like we were doing something wrong. I said we were here for a drink and was that OK? He said ""Excuse me?"" as if I'd said something completely ridiculous. I didn't know how to respond, so we continued and he followed us in and talked to the bartender in Greek as he made our (very expensive!) drinks. I don't know what he was saying, but he was gesturing towards us and the bartender was laughing awkwardly.  Once we had our drinks, we went outside and tried to find a seat. We saw someone sitting alone with 3 empty seats by him, and went over and asked if we could take the spare seats. He said there was someone sitting opposite, so we asked to take the two seats next to them, and he said ""Sorry, it's for 2 people."" So we said, ""Well, if we don't use the table, can we please take the chairs?"" he said that was OK, so we pulled the seats a short distance from the table and sat down, already feeling very awkward. His friend came out and started gesturing at us and shouting. The waiter came out and told us to move to a different table. We had done absolutely nothing wrong and not attempted to bother these people in anyway, just wanted to sit in nearby seats. The waiter was talking to them in an apologetic tone.  We finished our drinks and left as quickly as possible, feeling like we'd been thoroughly rejected.",August 2017,"{'name': 'Gwendolen W', 'handle': 'GwendolenW', 'location': 'Buckinghamshire, United Kingdom', 'age': '25-34', 'sex': 'woman', 'contributions': 23, 'cities_visited': 12, 'helpful_votes': 14, 'photo': 28, 'distribution': {'Excellent': 8, 'Very Good': 10, 'Average': 1, 'Poor': 2, 'Terrible': 2}}"
"{'id': '633537363', 'poi_location_id': '8759001', 'geolocation': 'g189473'}",JOIN Juice Bars,A different choice for those seeking something else apart from coffee!,"November 14, 2018",50,Warm environment with friendly staff! The juices are tasteful and the yogurt bowls delicious! The idea of offering healthy drinks and snacks is clever and it was missing from Thessaloniki. Well done!,October 2018,"{'name': 'Stathis K', 'handle': '307stathisk', 'contributions': 1, 'cities_visited': 1}"
"{'id': '508066665', 'poi_location_id': '8386847', 'geolocation': 'g189473'}",The Blue Cup,Cozy experience,"August 2, 2017",40,"We visited The Blue Cup for breakfast and we loved it. The atmosphere of the coffee shop was lovely, really nice for taking pictures and just enjoying the moment. Since I am a vegan, there wasn't anything for me to eat for breakfast neither they had a plant based milk so I only got a black coffee but like I said the overall experience was really nice. Also the waiters serving us were very friendly:)",August 2017,"{'name': 'Klaudia T', 'handle': 'Klaudika000', 'location': 'Thessaloniki, Greece', 'contributions': 3, 'cities_visited': 1, 'helpful_votes': 1, 'distribution': {'Excellent': 2, 'Very Good': 1, 'Average': 0, 'Poor': 0, 'Terrible': 0}}"
"{'id': '633524945', 'poi_location_id': '8759001', 'geolocation': 'g189473'}",JOIN Juice Bars,Morning glory served.🍎,"November 14, 2018",50,"The freshest ingredients, the kindest service. Try ""Winnie"" to make yourself smile at any given morning. Thanks, Join!",November 2018,"{'name': 'Christina D', 'handle': 'ChristinaD2394', 'contributions': 16, 'cities_visited': 12, 'helpful_votes': 4, 'distribution': {'Excellent': 11, 'Very Good': 3, 'Average': 2, 'Poor': 0, 'Terrible': 0}}"
"{'id': '505987657', 'poi_location_id': '8386847', 'geolocation': 'g189473'}",The Blue Cup,Lovely,"July 26, 2017",50,"Great outdoor atmosphere unique style great service good prices Go after 8pm , You won't be disappointed .",September 2016,"{'name': 'Ali Al-Yousif', 'handle': 'ali_alyousif', 'location': 'Abu Dhabi, United Arab Emirates', 'contributions': 13, 'cities_visited': 5, 'helpful_votes': 15, 'photo': 2, 'distribution': {'Excellent': 8, 'Very Good': 5, 'Average': 0, 'Poor': 0, 'Terrible': 0}}"
"{'id': '631337502', 'poi_location_id': '8759001', 'geolocation': 'g189473'}",JOIN Juice Bars,Great quick snack,"November 6, 2018",50,Great choice for a quick tasty nutritional snack-breakfast and great juices!The service is fast and always friendly.Love to visit this place!,November 2018,"{'name': 'evitaps96', 'handle': 'evitaps96', 'location': 'Athens, Greece', 'age': '35-49', 'sex': 'woman', 'contributions': 70, 'cities_visited': 179, 'helpful_votes': 19, 'photo': 28, 'distribution': {'Excellent': 37, 'Very Good': 21, 'Average': 7, 'Poor': 4, 'Terrible': 1}}"
"{'id': '764041269', 'poi_location_id': '5461549', 'geolocation': 'g189473'}",Sugar Angel,Must visit,"August 10, 2020",40,A decent non-commercial store with good sweet pastry and playful combinations. Compared to other sweet pastry stores around it offers you exactly what it's supposed to consistently without fluffy tags of free from...almost everything. 'No sugar' - 'No milk' - 'No pastry' - 'No dough'...More,August 2020,"{'name': 'Petros Kanakas', 'handle': 'petros_kanakas', 'location': 'Thessaloniki, Greece', 'contributions': 21, 'cities_visited': 7, 'helpful_votes': 30, 'distribution': {'Excellent': 6, 'Very Good': 7, 'Average': 3, 'Poor': 2, 'Terrible': 3}}"
"{'id': '505442539', 'poi_location_id': '8386847', 'geolocation': 'g189473'}",The Blue Cup,Simple and very good.,"July 25, 2017",50,"Great quality coffee, where you can tell the roast has been picked with care and good simple side honest dishes. Friendly staff willing to help you translate.",July 2017,"{'name': 'Jasper B', 'handle': '587baart', 'location': 'Utrecht, The Netherlands', 'contributions': 1, 'cities_visited': 1, 'photo': 1}"
"{'id': '621049059', 'poi_location_id': '8759001', 'geolocation': 'g189473'}",JOIN Juice Bars,No WiFi,"October 1, 2018",20,I went with a friend to study. We paid for the Coffee and when we connected to the WiFi we reliased that there was no Internet. We contacted the staf of the store and we were told that they could reset the Modem to fix the problem. After 20 min no reset and no Internet and no refund for the coffee of course. Not going there again,October 2018,"{'name': 'ste_pap24', 'handle': 'ste_pap24', 'location': 'Pefka, Greece', 'contributions': 135, 'cities_visited': 41, 'helpful_votes': 69, 'photo': 19, 'distribution': {'Excellent': 71, 'Very Good': 35, 'Average': 12, 'Poor': 8, 'Terrible': 9}}"
"{'id': '752677479', 'poi_location_id': '5461549', 'geolocation': 'g189473'}",Sugar Angel,"Inconsistent, Insulting, Terrible behavior","April 16, 2020",10,"We ordered a cake for my young son 4 days before his birthday. Our communication was written via email and everything was supposed to be organized but we were left without cake!!! Their behavior was so bad, insulting and rude they didn’t even apologize for the inconvenience. We found out that we had no cake at the day of his birthday. Pour little guy was so upset and cried so much because he was expecting the cake he chose. I definitely not recommend that shop to anybody!!!!! Completely unprofessional!",April 2020,"{'name': 'Eleanna', 'handle': 'EleannaSt', 'contributions': 1, 'cities_visited': 1, 'helpful_votes': 2}"
"{'id': '495055050', 'poi_location_id': '8386847', 'geolocation': 'g189473'}",The Blue Cup,Cocktail.,"June 22, 2017",50,Top. The best coffee and cocktail bar in town. Retail coffee. New cocktails. Alternative style. Amazing place,June 2017,"{'name': 'Akis-Shfis G', 'handle': 'akisshfisg', 'contributions': 1, 'cities_visited': 1}"
"{'id': '612939646', 'poi_location_id': '8759001', 'geolocation': 'g189473'}",JOIN Juice Bars,Suprise stop,"September 1, 2018",50,The view and especially the products are outstanding. Enjoyed a Maui fruit drink and a tuna sandwich that was very good. This is a must visit location at Thessaloniki.,September 2018,"{'name': 'maria o', 'handle': 'S2259JYmariao', 'contributions': 14, 'cities_visited': 5, 'helpful_votes': 18, 'photo': 3, 'distribution': {'Excellent': 6, 'Very Good': 1, 'Average': 3, 'Poor': 0, 'Terrible': 4}}"
"{'id': '717114438', 'poi_location_id': '5461549', 'geolocation': 'g189473'}",Sugar Angel,A small hidden gem!,"October 10, 2019",50,A great coffee spot downtown with even more delicious cakes and sweets! Try the cheesecake! ;-) Prices are respectable for the place given and more than welcome to serve you staff.,September 2019,"{'name': '*Lena*', 'handle': 'lena_tzo', 'contributions': 21, 'cities_visited': 16, 'helpful_votes': 46, 'photo': 11, 'distribution': {'Excellent': 11, 'Very Good': 6, 'Average': 1, 'Poor': 3, 'Terrible': 0}}"
"{'id': '491104223', 'poi_location_id': '8386847', 'geolocation': 'g189473'}",The Blue Cup,Best coffee in Thessaloniki,"June 6, 2017",50,I definitely recommend trying an espresso and a flat white.. The coffee is freshly roasted and the staff is really nice and helpful. It also looks really good,June 2017,"{'name': 'Bogdan_c87', 'handle': 'Bogdan_c87', 'contributions': 8, 'cities_visited': 6, 'helpful_votes': 1, 'distribution': {'Excellent': 8, 'Very Good': 0, 'Average': 0, 'Poor': 0, 'Terrible': 0}}"
"{'id': '596339655', 'poi_location_id': '8759001', 'geolocation': 'g189473'}",JOIN Juice Bars,Best place to stop by and refresh,"July 15, 2018",50,"I drank fredo espresso, frappe, Don Carleone and Rambo - loved them all. The guy was really nice and helpful",July 2018,"{'name': 'erbacioglu', 'handle': 'erbacioglu', 'contributions': 22, 'cities_visited': 20, 'photo': 14, 'distribution': {'Excellent': 7, 'Very Good': 13, 'Average': 2, 'Poor': 0, 'Terrible': 0}}"
"{'id': '630992696', 'poi_location_id': '5461549', 'geolocation': 'g189473'}",Sugar Angel,Not impressed at all.,"November 5, 2018",10,"Was walking by sugar angel with my friend & stopped in for a cupcake. Big mistake!! We got a vanilla cupcake with chocolate frosting that was easily a week old. How do we know, you ask? The center of the actual cake was dryer than the desert of the Saharah. I wish I had taken a picture of me dropping it in the closest trashbin right at the end of the street. I should’ve taken my €2.80 and flushed them down the toilet. Would’ve gotten more bang for my buck. AVOID!",November 2018,"{'name': 'Daydream12975746134', 'handle': 'Daydream12975746134', 'contributions': 1, 'cities_visited': 1}"
"{'id': '485103358', 'poi_location_id': '8386847', 'geolocation': 'g189473'}",The Blue Cup,The 3rd Wave Coffee but could be better,"May 17, 2017",40,This is a good place for coffee or drinks. I tried their cold brew and it was good (not very good though) They also provide roasted beans but when I was there they had some 15 days old roastings so I didn't bought them. A roastery should always had fresh roastings. Still I liked the place,May 2017,"{'name': 'Fırat Çıngı', 'handle': 'firatcingi', 'location': 'Bolu, Turkey', 'age': '35-49', 'sex': 'man', 'contributions': 106, 'cities_visited': 41, 'helpful_votes': 28, 'photo': 32, 'distribution': {'Excellent': 77, 'Very Good': 23, 'Average': 4, 'Poor': 2, 'Terrible': 0}}"
"{'id': '592215403', 'poi_location_id': '8759001', 'geolocation': 'g189473'}",JOIN Juice Bars,Fresh fruit juice,"July 1, 2018",40,"Very near the White Tower, this juice bar is a very nice place for a tasty fruit juice, or smoothie. An oasis in the summer heat of Thessaloniki. Wide range of choices, the kids liked it a lot. There is room for improvement in the decoration but without doubt a very good place for a fresh, tasty and healthy drink",July 2018,"{'name': '71Isaac', 'handle': '71Isaac', 'location': 'Kilkis, Greece', 'contributions': 162, 'cities_visited': 53, 'helpful_votes': 137, 'photo': 98, 'distribution': {'Excellent': 105, 'Very Good': 40, 'Average': 9, 'Poor': 7, 'Terrible': 1}}"
"{'id': '614358385', 'poi_location_id': '5461549', 'geolocation': 'g189473'}",Sugar Angel,"Very nice and unique, the staff could be more polite and helpful!","September 6, 2018",40,"The sweets are very tasty and nice, some of them are like art! The place is super sweet, white decoration ! Yet, the staff is sometimes rude and not so kind!",November 2017,"{'name': 'Kateerina K', 'handle': 'kateerinak', 'contributions': 4, 'cities_visited': 1, 'distribution': {'Excellent': 2, 'Very Good': 1, 'Average': 1, 'Poor': 0, 'Terrible': 0}}"
"{'id': '474966574', 'poi_location_id': '8386847', 'geolocation': 'g189473'}",The Blue Cup,Nice place to have a drink at night.,"April 12, 2017",50,"Greate deephouse mix, good atmosphere, cute barmens. The service is fast. We were there after 10 pm, the coffee bar was closing, but we had a drinks and enjoyed the evening. The music was top, and the volume was just right to hear each other. Very nice people, it was Monday, so the place was not overcrowded.",April 2017,"{'name': 'Leon K', 'handle': '372leonk', 'location': 'Haifa, Israel', 'age': '35-49', 'sex': 'man', 'contributions': 36, 'cities_visited': 75, 'helpful_votes': 23, 'photo': 31, 'distribution': {'Excellent': 24, 'Very Good': 9, 'Average': 3, 'Poor': 0, 'Terrible': 0}}"
"{'id': '583278655', 'poi_location_id': '8759001', 'geolocation': 'g189473'}",JOIN Juice Bars,So good juice,"May 28, 2018",50,"We were there three times - twice after working out and once for hangover recovery.  The juices are really excellent, the bowls are good too, and so is the coffee. They also play good music, and the staff are very friendly.  We didn't actually visit this particular JOIN (it's a chain), but the one in Ladadika.",May 2018,"{'name': 'Andreas V', 'handle': 'AndreasV502', 'location': 'Copenhagen, Denmark', 'age': '25-34', 'sex': 'man', 'contributions': 388, 'cities_visited': 282, 'helpful_votes': 117, 'photo': 11, 'distribution': {'Excellent': 169, 'Very Good': 200, 'Average': 19, 'Poor': 2, 'Terrible': 1}}"
"{'id': '603292225', 'poi_location_id': '5461549', 'geolocation': 'g189473'}",Sugar Angel,"Gonna love this, if you are a sweets lover!","August 6, 2018",40,"Wonderful coffee place, you can enjoy your favorite fresh cake with coffee, with a great variety, friendly atmosphere and perfect candy decoration!",April 2018,"{'name': 'Alexandra508', 'handle': 'Alexandra508', 'location': 'Thessaloniki, Greece', 'contributions': 45, 'cities_visited': 60, 'helpful_votes': 33, 'distribution': {'Excellent': 11, 'Very Good': 21, 'Average': 10, 'Poor': 3, 'Terrible': 0}}"
"{'id': '430416641', 'poi_location_id': '8386847', 'geolocation': 'g189473'}",The Blue Cup,Disappointed,"October 21, 2016",30,"My first experience with Blue Cup was quite good. I was excited to try their light roast coffee so I ordered Costa Rica chemex, which they served with sparkling water palate cleanser and biscuits. It was indeed very nice. Encouraged by my first visit I decided to go again on a Sunday. It was very busy I have to say, however for someone who also works in a business and knows the drills I was very disappointed to wait 20minutes to place my order and 30minutes to get my coffees. I ordered americano and V60. First one was delicious but V60? not so much... I can live with little over or under extractions but that coffee was too much. It was like licking a tire. Its bitterness was overwhelming. As far as I know, in Greece when you don't like something you can send it back and get something else you will enjoy instead, however discouraged by almost an hour wait I had to leave it as it was. Shame, because the place itself looks really interesting and the combination of bar and speciality coffee is a recipe for success. I would suggest trying a bit of pour-overs before you serve it.",October 2016,"{'name': 'Sara K', 'handle': '282sarak', 'contributions': 23, 'cities_visited': 9, 'helpful_votes': 10, 'photo': 17, 'distribution': {'Excellent': 18, 'Very Good': 2, 'Average': 2, 'Poor': 0, 'Terrible': 1}}"
"{'id': '578241829', 'poi_location_id': '8759001', 'geolocation': 'g189473'}",JOIN Juice Bars,Join Juicy,"May 6, 2018",50,"Right on the sea front of Thessaloniki you can enjoy a wide variety of juices. Reasonable prices, nice service and music.",May 2018,"{'name': 'trip-radar', 'handle': 'trip-radar', 'location': 'Rhodes Town, Greece', 'contributions': 168, 'cities_visited': 40, 'helpful_votes': 76, 'photo': 29, 'distribution': {'Excellent': 175, 'Very Good': 0, 'Average': 0, 'Poor': 0, 'Terrible': 0}}"
"{'id': '596656990', 'poi_location_id': '5461549', 'geolocation': 'g189473'}",Sugar Angel,nothing exceptional,"July 16, 2018",30,"It's a pleasant place to go for dessert, but the coffee quality is lower than the average of the town.",May 2018,"{'name': 'mariannakapp87', 'handle': 'mariannakapp87', 'location': 'Thessaloniki, Greece', 'contributions': 3, 'cities_visited': 2, 'distribution': {'Excellent': 1, 'Very Good': 1, 'Average': 1, 'Poor': 0, 'Terrible': 0}}"
"{'id': '430008799', 'poi_location_id': '8386847', 'geolocation': 'g189473'}",The Blue Cup,"Nice atmosphere, excellent music, cozy interior","October 20, 2016",50,"Excellent place to have a drink after dinner in Thessaloniki. The music mix is just perfect. Charming and friendly staff. Bar tender Nicos combines in a perfect way his mechanical engineering education with drink preparation skills. Try his version of Porn Star Martini - with citrus touch, very refreshing. Will give you energy for a long night of fun and dancing.",October 2016,"{'name': 'Ljuba K', 'handle': 'ljubak2015', 'location': 'Sofia, Bulgaria', 'contributions': 5, 'cities_visited': 6, 'helpful_votes': 6, 'distribution': {'Excellent': 3, 'Very Good': 1, 'Average': 1, 'Poor': 0, 'Terrible': 0}}"
"{'id': '569155560', 'poi_location_id': '8759001', 'geolocation': 'g189473'}",JOIN Juice Bars,Great juicy spot,"March 27, 2018",50,They have an excellent menu with lots of choices and the juices I tried were amazing. Everythingnis very fresh. Good stuff!,March 2018,"{'name': 'Mi R', 'handle': '14mir', 'location': 'Unter Gohren, Germany', 'contributions': 6, 'cities_visited': 5, 'helpful_votes': 1, 'photo': 3, 'distribution': {'Excellent': 6, 'Very Good': 0, 'Average': 0, 'Poor': 0, 'Terrible': 0}}"
"{'id': '578876752', 'poi_location_id': '5461549', 'geolocation': 'g189473'}",Sugar Angel,"Interesting cakes, some unusual tastes","May 8, 2018",40,Nice sweets and coffee place. Many different cakes with interesting tastes for everyone. Large selection of coffees and teas. Worthwhile visiting.,May 2018,"{'name': 'Marc A', 'handle': 'theogenis', 'location': 'Thessaloniki, Greece', 'age': '50-64', 'sex': 'man', 'contributions': 377, 'cities_visited': 204, 'helpful_votes': 241, 'photo': 313, 'distribution': {'Excellent': 165, 'Very Good': 145, 'Average': 46, 'Poor': 17, 'Terrible': 4}}"
"{'id': '405532916', 'poi_location_id': '8386847', 'geolocation': 'g189473'}",The Blue Cup,The best coffee shop in Thessaloniki,"August 14, 2016",50,"Nice place , clean and comfortable with finest coffee taste. We tried cappuccino and cold brewed coffee (which was served in little bottle and was very tasty). Also guys are friendly, gentle and they know how to make your day better using cup of coffee.",August 2016,"{'name': 'IcaVestica', 'handle': 'IcaVestica', 'location': 'Belgrade, Serbia', 'contributions': 12, 'cities_visited': 9, 'helpful_votes': 5, 'distribution': {'Excellent': 11, 'Very Good': 0, 'Average': 0, 'Poor': 1, 'Terrible': 0}}"
"{'id': '535254370', 'poi_location_id': '8759001', 'geolocation': 'g189473'}",JOIN Juice Bars,Healthy juice and smoothy bar,"October 22, 2017",50,"We went three times during our visit to Thessaloniki. The place is clean, modern and serves plenty of healthy juices, sweet and green smoothies, has almond, soy and coconut milk, good coffee and jumpy sandwiches. Free Wi-Fi. Great place!",October 2017,"{'name': 'lunabonita1', 'handle': 'lunabonita1', 'contributions': 24, 'cities_visited': 229, 'helpful_votes': 4, 'photo': 2, 'distribution': {'Excellent': 19, 'Very Good': 2, 'Average': 3, 'Poor': 0, 'Terrible': 0}}"
"{'id': '561721794', 'poi_location_id': '5461549', 'geolocation': 'g189473'}",Sugar Angel,Really nice place!,"February 20, 2018",40,"""Sugar Angel"" it's a really nice, luminous place to drink coffee or anything else from their list and taste a piece of their cakes! I recommend it for sure if you want a change in the city centre and if you are in the mood of something sweet! Just check it out!",January 2018,"{'name': 'Mariosss M', 'handle': 'mariosssm', 'contributions': 6, 'cities_visited': 4, 'helpful_votes': 1, 'distribution': {'Excellent': 4, 'Very Good': 2, 'Average': 0, 'Poor': 0, 'Terrible': 0}}"
"{'id': '403045452', 'poi_location_id': '8386847', 'geolocation': 'g189473'}",The Blue Cup,Highly recommended for a lazy Sunday afternoon,"August 8, 2016",50,This Coffee Roaster and Cocktail Bar is perfect for a lazy Sunday afternoon. The service is excellent and you might find difficult to decide what to order as the place offers some unique coffees and cocktails! Don't forget to buy coffee accessories and coffee from...More,October 2015,"{'name': 'Billie T', 'handle': 'vasilikibilliet', 'location': 'Wauwatosa, Wisconsin', 'age': '35-49', 'sex': 'woman', 'contributions': 50, 'cities_visited': 366, 'helpful_votes': 17, 'photo': 1, 'distribution': {'Excellent': 42, 'Very Good': 6, 'Average': 2, 'Poor': 0, 'Terrible': 0}}"
"{'id': '520947558', 'poi_location_id': '8759001', 'geolocation': 'g189473'}",JOIN Juice Bars,Gr8 healthy morning,"September 3, 2017",50,By chance everything else here opens at 9am and these guys were open at 8:30. great coffee & amazing juices and sandwiches - happy I ran into the place.,September 2017,"{'name': 'TCDHK', 'handle': 'TCDHK', 'location': 'Hong Kong, China', 'age': '35-49', 'sex': 'man', 'contributions': 106, 'cities_visited': 181, 'helpful_votes': 100, 'photo': 70, 'distribution': {'Excellent': 41, 'Very Good': 24, 'Average': 14, 'Poor': 18, 'Terrible': 9}}"
"{'id': '555940445', 'poi_location_id': '5461549', 'geolocation': 'g189473'}",Sugar Angel,Sweet Sweet Sweet,"January 23, 2018",50,The sweetest experience we had in the city of Thessaloniki.A small cozy cafeteria with very friendly staff fantastic decor very nice coffee and cakes to die for.A bit expensive but it deserves it.,January 2018,"{'name': 'Kostas K', 'handle': 'konkou', 'location': 'lesbos', 'age': '35-49', 'sex': 'man', 'contributions': 7, 'cities_visited': 278, 'photo': 1, 'distribution': {'Excellent': 4, 'Very Good': 2, 'Average': 1, 'Poor': 0, 'Terrible': 0}}"
"{'id': '373496338', 'poi_location_id': '8386847', 'geolocation': 'g189473'}",The Blue Cup,Great overall,"May 16, 2016",40,"I like it! Taste of coffee, service and prices. Location isn't great, but everything else is ok. They try to help people learn how to drink coffee the right way and make a great one!",May 2016,"{'name': 'iana anghel', 'handle': 'ianaanghel1991', 'location': 'Thessaloniki, Greece', 'sex': 'woman', 'contributions': 32, 'cities_visited': 11, 'helpful_votes': 13, 'photo': 7, 'distribution': {'Excellent': 7, 'Very Good': 6, 'Average': 4, 'Poor': 9, 'Terrible': 6}}"
"{'id': '517518658', 'poi_location_id': '8759001', 'geolocation': 'g189473'}",JOIN Juice Bars,Eating healthy snacks,"August 25, 2017",40,"Not another greek souvlaki store.It'a place where fast food is healthy and fresh.You can find salads,sandwiches and lots of juices and smoothies.Not expensive just in front of the sea.",August 2017,"{'name': 'Μαρία Σ', 'handle': 'J1908LV_', 'contributions': 19, 'cities_visited': 6, 'helpful_votes': 11, 'photo': 2, 'distribution': {'Excellent': 12, 'Very Good': 4, 'Average': 1, 'Poor': 0, 'Terrible': 2}}"
