_id,poi_name,title,date,review_rating,text,date_of_visit,reviewer
"{'id': '810128298', 'poi_location_id': '13236306', 'geolocation': 'g189473'}",Oberon,Confidence comes with experience and training,"September 15, 2021",30,"Oberon on the Aegean seafront serves the best Brunch in Thessaloniki. Try their Oberon omelette, quite delicious and beautifully garnished. Some of the staff are charming and confident - others, alas, seem to lack both English and confidence. This will come with experience and training. I look forward to visiting Oberon again for brunch, while I gaze out at the shimmering Aegean.",September 2021,"{'name': 'gillian k', 'handle': 'turas53', 'location': 'Dublin, Ireland', 'contributions': 54, 'cities_visited': 20, 'helpful_votes': 97, 'distribution': {'Excellent': 40, 'Very Good': 6, 'Average': 10, 'Poor': 1, 'Terrible': 1}}"
"{'id': '548824192', 'poi_location_id': '11620518', 'geolocation': 'g189473'}",Le Jardin Extraordinaire Cafe,Not if you don't smoke,"December 23, 2017",10,"This place,if you are a non smoker is...a disaster. Bummer,cause it's a cosy place, in the heart of center with good coffee and great side plates, with huge amounts of smoke!",December 2017,"{'name': 'Jannis K', 'handle': '894jannisk', 'location': 'Chekka, Lebanon', 'contributions': 1, 'cities_visited': 1, 'helpful_votes': 1}"
"{'id': '774378737', 'poi_location_id': '13236306', 'geolocation': 'g189473'}",Oberon,Great bar,"October 15, 2020",40,Great place comfy seats friendly staff food was nice and cheap drinks. Really nice vibe and music. Service a bit slow but not the end of the world the place was always busy and location great just of the square on the harbor,October 2020,"{'name': 'Hayley R', 'handle': 'hayleyr762', 'location': 'North York Moors National Park, United Kingdom', 'age': '25-34', 'sex': 'woman', 'contributions': 86, 'cities_visited': 192, 'helpful_votes': 81, 'photo': 97, 'distribution': {'Excellent': 21, 'Very Good': 33, 'Average': 27, 'Poor': 5, 'Terrible': 0}}"
"{'id': '548054876', 'poi_location_id': '11620518', 'geolocation': 'g189473'}",Le Jardin Extraordinaire Cafe,Not anything special,"December 19, 2017",30,"At a very nice place in the center of the city, this cafe is a decent choice. The idea of serving a pastry of your choice along with your coffee is one of the reasons that many people choose this place. However, the coffee is not very good, speakinf of quality, and it is quiet a noisy place. Also, last time I went there with a friend, we were waiting for about 30 minutes for a waitress to come but nobobdy appeared so we left.",September 2017,"{'name': 'Mary S', 'handle': 'D5835CHmarys', 'location': 'Greece', 'age': '25-34', 'sex': 'woman', 'contributions': 11, 'cities_visited': 14, 'helpful_votes': 1, 'distribution': {'Excellent': 6, 'Very Good': 2, 'Average': 1, 'Poor': 1, 'Terrible': 1}}"
"{'id': '743213273', 'poi_location_id': '13236306', 'geolocation': 'g189473'}",Oberon,Oberon,"February 5, 2020",20,"Not even close to “good”, worst coffee I’ve ever had, trivial designing, pancakes were drowning in Nutella and Oreos, seemed and tasted like bad cake. Tiny coffee tables and chairs, we didn’t fit in them. An expensive place not justifying its fame. Never again Oberon",January 2020,"{'name': 'Zoe M', 'handle': 'Happiness801546', 'contributions': 1, 'cities_visited': 1}"
"{'id': '494727636', 'poi_location_id': '8146397', 'geolocation': 'g189473'}",Todaylicious,"Delicious coffee, cheerful staff","June 20, 2017",40,Nice place for having a good coffee and taking a rest in the middle of Aristotelous Square. Staff is friendly and can speak English.,June 2017,"{'name': 'BurcuTunca', 'handle': 'BurcuTunca', 'location': 'Istanbul, Turkey', 'contributions': 18, 'cities_visited': 54, 'helpful_votes': 4, 'photo': 5, 'distribution': {'Excellent': 11, 'Very Good': 5, 'Average': 1, 'Poor': 0, 'Terrible': 2}}"
"{'id': '538508116', 'poi_location_id': '11620518', 'geolocation': 'g189473'}",Le Jardin Extraordinaire Cafe,Very good..,"November 5, 2017",40,"It's a busy, nicely decorated cafe in the center of the city with good prices, decent selection of beers and wines which serve with a big selection of dishes from the house...The only negative is that they allow smoking inside...",November 2017,"{'name': 'Alexandra M', 'handle': 'S3308UNalexandram', 'location': 'Kalamaria, Greece', 'contributions': 167, 'cities_visited': 53, 'helpful_votes': 55, 'photo': 131, 'distribution': {'Excellent': 76, 'Very Good': 74, 'Average': 15, 'Poor': 4, 'Terrible': 0}}"
"{'id': '681166822', 'poi_location_id': '13236306', 'geolocation': 'g189473'}",Oberon,W O W,"June 13, 2019",50,Food is just fantastic. Might be waiting up to 15 minutes for an omelette or scrambled eggs but it’s worth it. Food and ingredients are all fresh. The flavours will convince you if you don’t believe me. Fantastic service... beautiful view.,June 2019,"{'name': 'Bharat L', 'handle': 'barry_baby', 'location': 'Walsall, United Kingdom', 'sex': 'man', 'contributions': 6, 'cities_visited': 6, 'helpful_votes': 1, 'distribution': {'Excellent': 4, 'Very Good': 0, 'Average': 0, 'Poor': 0, 'Terrible': 2}}"
"{'id': '494727195', 'poi_location_id': '8146397', 'geolocation': 'g189473'}",Todaylicious,Friendly staff and nice coffee,"June 20, 2017",50,"Staff knows English really well, coffee is good and cheap. Can prefer to sit inside or outside, both are smoking areas. As its extremely central location its a nice place to hang out, use wifi and make plans for the trip.",June 2017,"{'name': 'Gökhan Hepşen', 'handle': 'yoldaki', 'location': 'Izmir Province, Turkey', 'contributions': 87, 'cities_visited': 66, 'helpful_votes': 30, 'photo': 28, 'distribution': {'Excellent': 38, 'Very Good': 32, 'Average': 9, 'Poor': 6, 'Terrible': 5}}"
"{'id': '675636355', 'poi_location_id': '13236306', 'geolocation': 'g189473'}",Oberon,"Nice location, nice food","May 22, 2019",40,"After a trip to the White Tower, we walked the short distance to Oberon for some lunch. As it was a warm day, we took advantage of the outdoor seating area and although it was next to a busy street, you couldn't really hear the traffic noise from the passing cars.  I had mozarella pizza which I have to say was one of the nicest I've had and my husband had a club sandwich which also looked really nice. Prices were very reasonable too.  The staff were very polite and attentive.",May 2019,"{'name': 'natf148', 'handle': 'natf148', 'location': 'Lincolnshire, United Kingdom', 'age': '25-34', 'sex': 'woman', 'contributions': 121, 'cities_visited': 82, 'helpful_votes': 69, 'photo': 90, 'distribution': {'Excellent': 25, 'Very Good': 67, 'Average': 23, 'Poor': 4, 'Terrible': 2}}"
"{'id': '408045420', 'poi_location_id': '8146397', 'geolocation': 'g189473'}",Todaylicious,Cheapest fast food,"August 20, 2016",40,"Todays are all around Thessaloniki. You will most likely find one in every corner. The prices are the lowest you'll find for fast food, snacks and drinks. It's basically a 24h place where they have anything, some include a mini market selling cigarettes and other things. What I recommend is their granita in summer. You can take up to 3-4 flavour in one cup and it only costs 1 euro.",August 2016,"{'name': 'Senby', 'handle': 'Senby', 'location': 'Thessaloniki, Greece', 'contributions': 40, 'cities_visited': 16, 'helpful_votes': 7, 'photo': 39, 'distribution': {'Excellent': 11, 'Very Good': 15, 'Average': 9, 'Poor': 5, 'Terrible': 0}}"
"{'id': '652941850', 'poi_location_id': '13236306', 'geolocation': 'g189473'}",Oberon,Really good,"February 17, 2019",50,"Had a really great evening there . The food was super good and the girls where super nice . When it is cold outside, they have heaters there to warm you up! Highly recommend this place",February 2019,"{'name': 'Jessi', 'handle': 'Jessinew', 'location': 'Nuremberg, Germany', 'sex': 'woman', 'contributions': 149, 'cities_visited': 61, 'helpful_votes': 69, 'photo': 27, 'distribution': {'Excellent': 72, 'Very Good': 34, 'Average': 20, 'Poor': 9, 'Terrible': 14}}"
"{'id': '366756730', 'poi_location_id': '8146397', 'geolocation': 'g189473'}",Todaylicious,Great snack food,"April 23, 2016",40,Cheap and cheerful well priced food that is served quickly served maybe not with a smaile but hey who cares. It is what it is. Cheap and cheerful.,April 2016,"{'name': 'Angela H', 'handle': '548angelah', 'location': 'London, United Kingdom', 'age': '35-49', 'sex': 'woman', 'contributions': 911, 'cities_visited': 133, 'helpful_votes': 411, 'distribution': {'Excellent': 74, 'Very Good': 693, 'Average': 128, 'Poor': 15, 'Terrible': 13}}"
"{'id': '632753131', 'poi_location_id': '13236306', 'geolocation': 'g189473'}",Oberon,Easy to find breakfast place,"November 12, 2018",40,"This was the first breakfast place we came across and we went in as was easy and convenient on our way to the tower. Nothing extraordinary, but the service was good, the food was decent so did not disappoint. Also did not cost that much.",November 2018,"{'name': 'nastikm', 'handle': 'nastikm', 'location': 'London, United Kingdom', 'age': '35-49', 'sex': 'woman', 'contributions': 154, 'cities_visited': 50, 'helpful_votes': 93, 'distribution': {'Excellent': 106, 'Very Good': 27, 'Average': 17, 'Poor': 3, 'Terrible': 1}}"
"{'id': '363429057', 'poi_location_id': '8146397', 'geolocation': 'g189473'}",Todaylicious,Decent enough,"April 11, 2016",50,One of the best todaylicious stores in town great for takeaway coffees and snacks. Two-floor store for chill and study as well.,March 2016,"{'name': 'Christos P', 'handle': 'Christos_Papaioannoy', 'contributions': 19, 'cities_visited': 10, 'helpful_votes': 6, 'photo': 2, 'distribution': {'Excellent': 11, 'Very Good': 4, 'Average': 2, 'Poor': 0, 'Terrible': 2}}"
"{'id': '575975322', 'poi_location_id': '13236306', 'geolocation': 'g189473'}",Oberon,"Great service, kind people","April 26, 2018",50,"Excellent service, people available to help you and find you a place that suits you and very kind. Food of excellent quality as well!",April 2018,"{'name': 'Aimilia L', 'handle': 'aimilial2018', 'contributions': 1, 'cities_visited': 1}"
"{'id': '346858832', 'poi_location_id': '8146397', 'geolocation': 'g189473'}",Todaylicious,Delicious!,"February 11, 2016",50,"You can have delicious snacks here. The prices are reasonable.Whenever you feel a little hungry or for just coffee,you can have it here.",January 2016,"{'name': 'Nil B', 'handle': 'alohanil', 'location': 'Istanbul, Turkey', 'contributions': 74, 'cities_visited': 92, 'helpful_votes': 31, 'distribution': {'Excellent': 54, 'Very Good': 16, 'Average': 6, 'Poor': 0, 'Terrible': 0}}"
"{'id': '558473119', 'poi_location_id': '13236306', 'geolocation': 'g189473'}",Oberon,Amazing,"February 4, 2018",50,Me and my friends stop in this joint randomly. The hostes was very polite and nice she seated us in the best tabel with the beautiful view to see the Aegean Sea. The waiter came and took our order he spoke well english and was very patient with untill we decided what we wanted. I had the Sangre wine which was semi sweet wine which was the best wine I ever had. We were very pleased with the services the product and everything. Its worth the stop.,February 2018,"{'name': 'Amina A', 'handle': '843aminab', 'location': 'Lexington, Illinois', 'contributions': 5, 'cities_visited': 5, 'helpful_votes': 4, 'distribution': {'Excellent': 3, 'Very Good': 0, 'Average': 0, 'Poor': 1, 'Terrible': 1}}"
"{'id': '335194092', 'poi_location_id': '8146397', 'geolocation': 'g189473'}",Todaylicious,"Fast service, tasty, cheap","December 27, 2015",50,Don't be scared of the long line because thanks to quick staff it will be gone in seconds. You can find the shop at every corner of the city.,December 2015,"{'name': 'iarigby', 'handle': 'iarigby', 'location': 'Budapest, Hungary', 'sex': 'woman', 'contributions': 24, 'cities_visited': 9, 'helpful_votes': 6, 'photo': 4, 'distribution': {'Excellent': 19, 'Very Good': 2, 'Average': 2, 'Poor': 1, 'Terrible': 0}}"
"{'id': '662835553', 'poi_location_id': '7897094', 'geolocation': 'g189473'}",BLENDAIR Juice & Coffee,Nice place to sit and relax,"April 1, 2019",50,"The outdoor seating offers you a good view of the Palace of Galerius, a nice backdrop to have a coffee and a snack. We had the special fruitdish, very tasty with fresh fruit. The waitress was very friendly.",April 2019,"{'name': 'Monique E', 'handle': 'moniquee2016', 'location': 'The Netherlands', 'age': '50-64', 'sex': 'woman', 'contributions': 409, 'cities_visited': 142, 'helpful_votes': 208, 'photo': 621, 'distribution': {'Excellent': 167, 'Very Good': 166, 'Average': 60, 'Poor': 13, 'Terrible': 4}}"
"{'id': '322579139', 'poi_location_id': '8146397', 'geolocation': 'g189473'}",Todaylicious,cheap and pretty good quality,"October 28, 2015",40,"The place has been build on a ruined old wall , with inox an glass infrastrucures, cozy , young crowded , cheap , fast.",October 2015,"{'name': 'robertandoroma', 'handle': 'robertandoroma', 'location': 'Rome, Italy', 'age': '35-49', 'sex': 'man', 'contributions': 44, 'cities_visited': 325, 'helpful_votes': 22, 'photo': 4, 'distribution': {'Excellent': 24, 'Very Good': 12, 'Average': 4, 'Poor': 1, 'Terrible': 3}}"
"{'id': '662834925', 'poi_location_id': '7897094', 'geolocation': 'g189473'}",BLENDAIR Juice & Coffee,Great great,"April 1, 2019",50,"Again a place were the staff is friendly and welcoming, the lunch we had was great and the prices reasonable. Oh, and the great views on the ruins of the palace of Galerius.",April 2019,"{'name': 'Hans', 'handle': 'hansv245', 'location': 'Kwadendamme, The Netherlands', 'age': '50-64', 'sex': 'man', 'contributions': 608, 'cities_visited': 189, 'helpful_votes': 210, 'photo': 776, 'distribution': {'Excellent': 217, 'Very Good': 242, 'Average': 129, 'Poor': 16, 'Terrible': 5}}"
"{'id': '617359025', 'poi_location_id': '7897094', 'geolocation': 'g189473'}",BLENDAIR Juice & Coffee,Excellent juice bar,"September 17, 2018",50,On the spot decision to visit it with a friend here. Turned out to be great. Very reasonably priced and very nice juices as well.,September 2018,"{'name': 'Fotis K', 'handle': 'protagonistofficial', 'location': 'Oxford, United Kingdom', 'age': '25-34', 'sex': 'man', 'contributions': 20, 'cities_visited': 9, 'helpful_votes': 8, 'photo': 2, 'distribution': {'Excellent': 11, 'Very Good': 5, 'Average': 2, 'Poor': 0, 'Terrible': 2}}"
"{'id': '421790108', 'poi_location_id': '7897094', 'geolocation': 'g189473'}",BLENDAIR Juice & Coffee,Best place in thessaloniki,"September 24, 2016",50,We came consecutive days. 4 euro cocktails that blow the competition away. Cool music and amazing service. A must for travellers.,September 2016,"{'name': 'Michael G', 'handle': 'X4537ROmichaelg', 'contributions': 18, 'cities_visited': 5, 'helpful_votes': 3, 'photo': 2, 'distribution': {'Excellent': 12, 'Very Good': 4, 'Average': 1, 'Poor': 0, 'Terrible': 1}}"
"{'id': '262167481', 'poi_location_id': '7897094', 'geolocation': 'g189473'}",BLENDAIR Juice & Coffee,!!!!!!!!!!!!!,"March 27, 2015",50,"fresh fruits all over the place , ideal place with a great view of the remains of the galeriou's palace !",March 2015,"{'name': 'giovanni g', 'handle': 'Q5032OLgiovannig', 'location': 'Neapoli, Greece', 'contributions': 2, 'cities_visited': 58, 'photo': 2}"
"{'id': '677103460', 'poi_location_id': '12849728', 'geolocation': 'g189473'}",Cafe Floral,Cafe floral,"May 28, 2019",50,"Great coffee, ambient environment, snacks, sweets, juices, smoothies and a comfortable outside space to smoke, since in the place, smoking is not allowed.",September 2017,"{'name': 'George.C.Georgiou', 'handle': 'Georgiou2607', 'contributions': 1, 'cities_visited': 1, 'helpful_votes': 2, 'photo': 27}"
"{'id': '676855433', 'poi_location_id': '12849728', 'geolocation': 'g189473'}",Cafe Floral,Coffee break,"May 27, 2019",50,"Great place , great coffee, great decoration, nice atmosphere, great snack!!!! Nice place to relax between meetings, or for meeting also , for work of for fun :)",November 2018,"{'name': 'Daydream68033', 'handle': 'Daydream68033', 'contributions': 1, 'cities_visited': 254, 'helpful_votes': 2}"
"{'id': '831862595', 'poi_location_id': '15237892', 'geolocation': 'g189473'}",Dolce Cafe,how cute!,"March 21, 2022",50,"Lovely cafe with gorgeous kitsch decor, inside and with the pretty seating outside. Service was excellent, as was the frappe. Perfect coffee spot in the square. Recommend!",March 2022,"{'name': 'BunchOfLilies', 'handle': 'BunchOfLilies', 'location': 'London, United Kingdom', 'age': '25-34', 'sex': 'woman', 'contributions': 619, 'cities_visited': 312, 'helpful_votes': 304, 'photo': 77, 'distribution': {'Excellent': 392, 'Very Good': 161, 'Average': 51, 'Poor': 17, 'Terrible': 1}}"
"{'id': '823704476', 'poi_location_id': '15237892', 'geolocation': 'g189473'}",Dolce Cafe,Tea,"January 2, 2022",40,"Stopped off for a tea near to our apartment. Very helpful lady advised me on the menu and picked a lovely tea for me based on what I told her. Nice position to watch the city go by right on the main square. Quaint decor and crockery, very nostalgic.",November 2021,"{'name': 'Sharon W', 'handle': 'shazjulie66', 'location': 'Nottingham, United Kingdom', 'age': '50-64', 'sex': 'woman', 'contributions': 790, 'cities_visited': 301, 'helpful_votes': 368, 'photo': 410, 'distribution': {'Excellent': 217, 'Very Good': 567, 'Average': 10, 'Poor': 0, 'Terrible': 0}}"
"{'id': '694139680', 'poi_location_id': '15237892', 'geolocation': 'g189473'}",Dolce Cafe,Great breakfast!,"July 30, 2019",50,"I had just arrived in Thessaloniki off an overnight bus from Istanbul and needed somewhere with WiFi and decent food. This had both!  I ordered an egg and toast but they didn't have it. The very nice waitress suggested I go for the bougatsa. It was excellent! Warm and filled with cheese. Although I have nothing to compare it with, it was very nice (as was the cappuccino).",July 2019,"{'name': 'JamesFFC', 'handle': 'JamesFFC', 'location': 'Maidenhead, United Kingdom', 'age': '18-24', 'sex': 'man', 'contributions': 583, 'cities_visited': 236, 'helpful_votes': 268, 'photo': 36, 'distribution': {'Excellent': 317, 'Very Good': 175, 'Average': 67, 'Poor': 23, 'Terrible': 8}}"
"{'id': '637795078', 'poi_location_id': '15237892', 'geolocation': 'g189473'}",Dolce Cafe,Excellent,"December 6, 2018",50,Wonderful environment and decoration with its own unique character! Service was very kind and fast. There is always a savory or sweet treat with every beverage! Desserts are delicious and homemade! In the morning you can find traditional greek pies and bougatsa!,December 2018,"{'name': 'Sofia S', 'handle': 'sofiasH4531NQ', 'contributions': 2, 'cities_visited': 2}"
"{'id': '767339157', 'poi_location_id': '11698622', 'geolocation': 'g189473'}",Eklektik,Still amazing,"August 27, 2020",50,"I visit this place every August, either for coffee or food. I am happy to say that it remains amazing. The service and the food are excellent. All the products are from Greek origins and of good quality. This time we got the breakfast platter...More",August 2020,"{'name': 'Elias Alpha', 'handle': 'Elias_Alpha', 'location': 'London, United Kingdom', 'age': '35-49', 'sex': 'man', 'contributions': 429, 'cities_visited': 153, 'helpful_votes': 221, 'photo': 225, 'distribution': {'Excellent': 243, 'Very Good': 125, 'Average': 48, 'Poor': 7, 'Terrible': 8}}"
"{'id': '696501351', 'poi_location_id': '11698622', 'geolocation': 'g189473'}",Eklektik,Happy crying after dinner,"August 7, 2019",50,I have no words how this is tasty!!! Recommed to everybody visit this cute and kind place. First visit and so lucky! I'm happy))),August 2019,"{'name': 'Илья Е', 'handle': 'Compass432262', 'contributions': 1, 'cities_visited': 5, 'helpful_votes': 1}"
"{'id': '635405581', 'poi_location_id': '11698622', 'geolocation': 'g189473'}",Eklektik,Cosy place,"November 24, 2018",50,"We visited Eklektik twice in a weekend and we found it perfect place for coffee or drink. Excellent quality of local products from all over Greece, and fair trade ones, to consume in house or take away. We had both coffee and old spirit tsipouro witch were all tasteful. Very friendly service , value for money . Highly recommended!",November 2018,"{'name': 'Ioannis G', 'handle': 'IOANNISGOL', 'location': 'Athens, Greece', 'age': '25-34', 'sex': 'man', 'contributions': 56, 'cities_visited': 27, 'helpful_votes': 40, 'photo': 101, 'distribution': {'Excellent': 13, 'Very Good': 33, 'Average': 8, 'Poor': 2, 'Terrible': 0}}"
"{'id': '748234997', 'poi_location_id': '12676952', 'geolocation': 'g189473'}",Coffee Island,"Fast take away, good prices, perfect taste.","February 28, 2020",50,"One of the best coffee island stores in Thessaloniki. Coffee and bakes are always fresh and the staff is always welcoming. The street has a good atmosphere so it makes you feel relaxed. If you stay close to here, you can also take your coffee...More",February 2020,"{'name': 'Mert bey', 'handle': 'mertbey43', 'contributions': 8, 'cities_visited': 38, 'helpful_votes': 2, 'distribution': {'Excellent': 8, 'Very Good': 0, 'Average': 0, 'Poor': 0, 'Terrible': 0}}"
"{'id': '620136295', 'poi_location_id': '11698622', 'geolocation': 'g189473'}",Eklektik,fantastic,"September 28, 2018",50,"Loved this place. Great breakfast with croque monsieur made of local sheep cheese and Greek heirloom ham; excellent coffee; attentive, helpful service; unparalleled selection of local organic goods in the deli.",September 2018,"{'name': 'Noga T', 'handle': 'nogat2016', 'location': 'Jerusalem, Israel', 'contributions': 30, 'cities_visited': 19, 'helpful_votes': 10, 'photo': 3, 'distribution': {'Excellent': 28, 'Very Good': 3, 'Average': 0, 'Poor': 0, 'Terrible': 0}}"
"{'id': '742078367', 'poi_location_id': '12676952', 'geolocation': 'g189473'}",Coffee Island,"Good coffee and pastry, fast service","January 30, 2020",40,"Coffee Island is a chain of coffee shops; there are several in Thessaloniki. I stopped in for a late-morning break. My cappuccino was hot, freshly made, and served with a flourish. I had a cheese-filled pastry to go with it, flaky and warm. The staff were friendly and efficient, and spoke some English. The dining area was tidy and the restroom was clean.",June 2019,"{'name': 'Carol A S', 'handle': 'carolas936', 'location': 'Marietta, Georgia', 'age': '50-64', 'sex': 'woman', 'distribution': {'Excellent': 334, 'Very Good': 781, 'Average': 285, 'Poor': 20, 'Terrible': 1}}"
"{'id': '608994520', 'poi_location_id': '11698622', 'geolocation': 'g189473'}",Eklektik,Excellent place for coffee and lunch,"August 21, 2018",50,This is an amazing place to come for your coffee and/ or lunch. The small dishes are delicious and the prices are very cheap. The service is very friendly and efficient. It is definitely worth a visit.,August 2018,"{'name': 'Elias Alpha', 'handle': 'Elias_Alpha', 'location': 'London, United Kingdom', 'age': '35-49', 'sex': 'man', 'contributions': 429, 'cities_visited': 153, 'helpful_votes': 221, 'photo': 225, 'distribution': {'Excellent': 243, 'Very Good': 125, 'Average': 48, 'Poor': 7, 'Terrible': 8}}"
"{'id': '739080926', 'poi_location_id': '12676952', 'geolocation': 'g189473'}",Coffee Island,"Fast, fresh, and delicious.","January 14, 2020",40,The place offers fast and delicious food. We ate a fine cheese pastry there and enjoyed fresh orange juice.,January 2020,"{'name': 'Yifat Ben Baruch', 'handle': 'Yifat94', 'location': 'Israel', 'contributions': 23, 'cities_visited': 9, 'helpful_votes': 56, 'distribution': {'Excellent': 14, 'Very Good': 7, 'Average': 3, 'Poor': 0, 'Terrible': 1}}"
"{'id': '636357688', 'poi_location_id': '12676952', 'geolocation': 'g189473'}",Coffee Island,I love this brand,"November 28, 2018",50,I bought filtered coffee capsules of this brand. They are nespresso machine compatible capsules if you are interested. And good price of the value...Stuff is helpful and kind. Bravo...,November 2018,"{'name': 'Özge Göçer', 'handle': 'ozgegocer', 'location': 'Marmaris, Turkey', 'contributions': 73, 'cities_visited': 25, 'helpful_votes': 49, 'photo': 36, 'distribution': {'Excellent': 58, 'Very Good': 7, 'Average': 6, 'Poor': 1, 'Terrible': 1}}"
"{'id': '641640812', 'poi_location_id': '968027', 'geolocation': 'g189473'}",To Diatiriteo,Fantastic Seasonal Decoration Great place to go,"December 26, 2018",40,We visited the cafe with friends.The decoration for the season (Christmas) was fantastic!!! The place was full but we finally found a place to sit.It is highly recommended!!!,December 2018,"{'name': 'Dimitris M', 'handle': '727dimitrism', 'location': 'Thessaloniki, Greece', 'contributions': 14, 'cities_visited': 3, 'helpful_votes': 1, 'distribution': {'Excellent': 5, 'Very Good': 6, 'Average': 1, 'Poor': 0, 'Terrible': 2}}"
"{'id': '638120672', 'poi_location_id': '968027', 'geolocation': 'g189473'}",To Diatiriteo,Cosy atmosphere & lovely music,"December 8, 2018",50,This café/bar is located at the first floor of a building in the city center. Liked the atmosphere and the music. The decoration especially during the Christmas period makes it a cosy place to go for a coffee or a drink.,December 2018,"{'name': 'Lyxandros', 'handle': 'lyxandros', 'location': 'Thessaloniki, Greece', 'age': '25-34', 'sex': 'man', 'contributions': 47, 'cities_visited': 17, 'helpful_votes': 11, 'photo': 7, 'distribution': {'Excellent': 27, 'Very Good': 13, 'Average': 4, 'Poor': 1, 'Terrible': 2}}"
